{
  "generatedAt": "2026-04-09T20:06:59.804Z",
  "model": "karpathy-llm-wiki-pattern",
  "sources": [
    {
      "id": "tools",
      "file": "src/content/data/tools.json",
      "description": "Master catalog for professional tools."
    },
    {
      "id": "surfaces",
      "file": "src/content/data/freeconvert-catalog.json",
      "description": "Convert/Compress/Tools surface catalog."
    },
    {
      "id": "convertio-formats",
      "file": "src/content/data/competitor-convertio-formats.json",
      "description": "Competitor format intelligence feed generated by scraper."
    }
  ],
  "stats": {
    "categories": 8,
    "tools": 120,
    "publishedTools": 120,
    "surfaces": 3,
    "surfaceGroups": 12,
    "surfaceTools": 67,
    "competitorCategories": 10,
    "competitorFormats": 309
  },
  "categories": [
    {
      "slug": "writing-messaging",
      "name": "Writing and Messaging",
      "order": 1,
      "description": "Deterministic writing frameworks, messaging structures, and conversion-focused text utilities.",
      "toolCount": 15,
      "publishedCount": 15
    },
    {
      "slug": "seo-content-ops",
      "name": "SEO and Content Operations",
      "order": 2,
      "description": "Metadata, structure, and content-operations helpers for search-ready publishing.",
      "toolCount": 15,
      "publishedCount": 15
    },
    {
      "slug": "productivity-planning",
      "name": "Productivity and Planning",
      "order": 3,
      "description": "Planning templates and decision frameworks for execution and team workflows.",
      "toolCount": 15,
      "publishedCount": 15
    },
    {
      "slug": "developer-data-core",
      "name": "Developer and Data Core",
      "order": 4,
      "description": "Formatting, conversion, and core developer utility tools for technical workflows.",
      "toolCount": 15,
      "publishedCount": 15
    },
    {
      "slug": "developer-advanced",
      "name": "Developer Utilities Advanced",
      "order": 5,
      "description": "Higher-level development helpers for requests, parsing, and technical execution workflows.",
      "toolCount": 15,
      "publishedCount": 15
    },
    {
      "slug": "business-finance",
      "name": "Business and Finance",
      "order": 6,
      "description": "Deterministic finance and operations calculators for business planning and decisions.",
      "toolCount": 15,
      "publishedCount": 15
    },
    {
      "slug": "design-ux-brand",
      "name": "Design, UX, and Brand",
      "order": 7,
      "description": "Design-system, UX, and messaging tools for better product communication.",
      "toolCount": 15,
      "publishedCount": 15
    },
    {
      "slug": "education-team-communication",
      "name": "Education, Career, and Team Communication",
      "order": 8,
      "description": "Learning, career, and team communication templates for practical execution.",
      "toolCount": 15,
      "publishedCount": 15
    }
  ],
  "surfaces": [
    {
      "slug": "convert",
      "name": "Convert",
      "description": "Convert media and document formats with deterministic browser-first workflows and clear capability boundaries.",
      "groupCount": 5,
      "toolCount": 38,
      "groups": [
        {
          "slug": "video-audio",
          "name": "Video and Audio",
          "toolCount": 8,
          "tools": [
            {
              "name": "Audio Converter",
              "slug": "audio-converter",
              "status": "active"
            },
            {
              "name": "MOV to MP4",
              "slug": "mov-to-mp4",
              "status": "active"
            },
            {
              "name": "MP3 Converter",
              "slug": "mp3-converter",
              "status": "active"
            },
            {
              "name": "MP3 to OGG",
              "slug": "mp3-to-ogg",
              "status": "active"
            },
            {
              "name": "MP4 Converter",
              "slug": "mp4-converter",
              "status": "active"
            },
            {
              "name": "MP4 to MP3",
              "slug": "mp4-to-mp3",
              "status": "active"
            },
            {
              "name": "Video Converter",
              "slug": "video-converter",
              "status": "active"
            },
            {
              "name": "Video to MP3",
              "slug": "video-to-mp3",
              "status": "active"
            }
          ]
        },
        {
          "slug": "image",
          "name": "Image",
          "toolCount": 8,
          "tools": [
            {
              "name": "HEIC to JPG",
              "slug": "heic-to-jpg",
              "status": "active"
            },
            {
              "name": "HEIC to PNG",
              "slug": "heic-to-png",
              "status": "active"
            },
            {
              "name": "Image Converter",
              "slug": "image-converter",
              "status": "active"
            },
            {
              "name": "JFIF to PNG",
              "slug": "jfif-to-png",
              "status": "active"
            },
            {
              "name": "PNG to SVG",
              "slug": "png-to-svg",
              "status": "active"
            },
            {
              "name": "SVG Converter",
              "slug": "svg-converter",
              "status": "active"
            },
            {
              "name": "WEBP to JPG",
              "slug": "webp-to-jpg",
              "status": "active"
            },
            {
              "name": "WEBP to PNG",
              "slug": "webp-to-png",
              "status": "active"
            }
          ]
        },
        {
          "slug": "pdf-documents",
          "name": "PDF and Documents",
          "toolCount": 10,
          "tools": [
            {
              "name": "Document Converter",
              "slug": "document-converter",
              "status": "active"
            },
            {
              "name": "DOCX to PDF",
              "slug": "docx-to-pdf",
              "status": "active"
            },
            {
              "name": "Ebook Converter",
              "slug": "ebook-converter",
              "status": "active"
            },
            {
              "name": "EPUB to PDF",
              "slug": "epub-to-pdf",
              "status": "active"
            },
            {
              "name": "HEIC to PDF",
              "slug": "heic-to-pdf",
              "status": "active"
            },
            {
              "name": "JPG to PDF",
              "slug": "jpg-to-pdf",
              "status": "active"
            },
            {
              "name": "PDF Converter",
              "slug": "pdf-converter",
              "status": "active"
            },
            {
              "name": "PDF to EPUB",
              "slug": "pdf-to-epub",
              "status": "active"
            },
            {
              "name": "PDF to JPG",
              "slug": "pdf-to-jpg",
              "status": "active"
            },
            {
              "name": "PDF to Word",
              "slug": "pdf-to-word",
              "status": "active"
            }
          ]
        },
        {
          "slug": "gif",
          "name": "GIF",
          "toolCount": 9,
          "tools": [
            {
              "name": "APNG to GIF",
              "slug": "apng-to-gif",
              "status": "active"
            },
            {
              "name": "AVI to GIF",
              "slug": "avi-to-gif",
              "status": "active"
            },
            {
              "name": "GIF to APNG",
              "slug": "gif-to-apng",
              "status": "active"
            },
            {
              "name": "GIF to MP4",
              "slug": "gif-to-mp4",
              "status": "active"
            },
            {
              "name": "Image to GIF",
              "slug": "image-to-gif",
              "status": "active"
            },
            {
              "name": "MOV to GIF",
              "slug": "mov-to-gif",
              "status": "active"
            },
            {
              "name": "MP4 to GIF",
              "slug": "mp4-to-gif",
              "status": "active"
            },
            {
              "name": "Video to GIF",
              "slug": "video-to-gif",
              "status": "active"
            },
            {
              "name": "WEBM to GIF",
              "slug": "webm-to-gif",
              "status": "active"
            }
          ]
        },
        {
          "slug": "others",
          "name": "Others",
          "toolCount": 3,
          "tools": [
            {
              "name": "Archive Converter",
              "slug": "archive-converter",
              "status": "active"
            },
            {
              "name": "Time Converter",
              "slug": "time-converter",
              "status": "active"
            },
            {
              "name": "Unit Converter",
              "slug": "unit-converter",
              "status": "active"
            }
          ]
        }
      ]
    },
    {
      "slug": "compress",
      "name": "Compress",
      "description": "Reduce media and document size with deterministic and transparent in-browser compression flows.",
      "groupCount": 4,
      "toolCount": 8,
      "groups": [
        {
          "slug": "video-audio",
          "name": "Video and Audio",
          "toolCount": 3,
          "tools": [
            {
              "name": "MP3 Compressor",
              "slug": "mp3-compressor",
              "status": "active"
            },
            {
              "name": "Video Compressor",
              "slug": "video-compressor",
              "status": "active"
            },
            {
              "name": "WAV Compressor",
              "slug": "wav-compressor",
              "status": "active"